51594,Comércio Atacadista de Outros Produtos Intermediários não Agropecuários  não Especificados Anteriormente
51616,Comércio Atacadista de Máquinas  Aparelhos e Equipamentos para Uso Agropecuário
51624,Com. Atacadista de Máq e Equip para O Comércio (Desativado)
51632,Com. Atacadista de Máq e Equip para Escritório (Desativado)
51640,Comércio Atacadista de Máquinas e Equipamentos para O Comércio e Escritório
51659,Comércio Atacadista de Computadores   Equipamentos de Telefonia e Comunicação  Partes e Peças
51691,Comércio Atacadista de Máquinas  Aparelhos e Equipamentos para Usos Industrial  Técnico e Profissional  e Outros Usos  não Especificados Anterio
51918,Comércio Atacadista de Mercadorias em Geral (Não Especializado)
51926,Comércio Atacadista Especializado em Mercadorias não Especificadas Anteriormente
52116,Comércio Var. de Merc. Geral  c/ Pred. Prod. Alim.  com Área de Venda Superior a 5000 Metros Quadrados  Hipe
52124,Comércio Varej. de Merc. Geral  c/ Pred. Prod. Alim.  com Área de Venda Entre 300 e 5000 Metros Quadrados  Sup
52132,Comércio Varejista de Merc. Geral  c/ Pred. Prod. Alim.  com Área de Venda Inferior a 300 Metros Quadrados  Excet
52140,Comércio Varejist de Merc. Geral  c/ Pred. Prod. Alim. Ind. Lojas de Conveniência
52159,Comércio Varejista não Especializado  sem Predominância de Produtos Alimentícios
52213,Comércio Varejista de Produtos de Padaria  de Laticínio  Frios e Conservas
52221,Comércio Varejista de Balas  Bombons e Semelhantes
52230,Comércio Varejista de Carnes  Açougues
52248,Comércio Varejista de Bebidas
52299,Comércio Varejista de Outros Produtos Alimentícios não Especificados Anteriormente e de Produtos do Fumo
52310,Comércio Varejista de Tecidos e Artigos de Armarinho
52329,Comércio Varejista de Artigos do Vestuário e Complementos
52337,Comércio Varejista de Calçados  Artigos de Couro e Viagem
52418,Comércio Varejista de Produtos Farmacêuticos  Artigos Médicos e Ortopédicos  de Perfumaria e Cosméticos
52426,Comércio Varejista de Máquinas e Aparelhos de Usos Doméstico e Pessoal  Discos e Instrumentos Musicais
52434,Comércio Varejista de Móveis  Artigos de Iluminação e Outros Artigos para Residência
52442,Comércio Varejista de Material de Construção  Ferragens e Ferramentas Manuais
52450,Comércio Varejista de Equipamentos e Materiais para Escritório
52469,Comércio Varejista de Livros  Jornais  Revistas e Papelaria
52477,Comércio Varejista de Gás Liquefeito de Petróleo (Glp)
52493,Comércio Varejista de Outros Produtos não Especificados Anteriormente
52507,Comércio Varejista de Artigos Usados
52612,Com Var de Artigos em Geral  por Catálogo ou Correio (Desativado)
52620,Comércio em Vias Públicas  Exceto em Quiosques Fixos
52698,Outros Tipos de Comércio Varejista
52710,Reparação e Manutenção de Máquinas e de Aparelhos Eletrodomésticos
52728,Reparação de Calçados
52795,Reparação de Outros Objetos Pessoais e Domésticos
55115,Estabelecimentos Hoteleiros  com Restaurante (Desativado)
55123,Estabelecimentos Hoteleiros  sem Restaurante (Desativado)
55131,Estabelecimentos Hoteleiros
55190,Outros Tipos de Alojamento
55212,Restaurantes e Estabelecimentos de Bebidas  com Serviço Completo
55220,Lanchonetes e Similares
55239,Cantinas (Serviços de Alimentação Privativos)
55247,Fornecimento de Comida Preparada
55298,Outros Serviços de Alimentação
60100,Transporte Ferroviário Interurbano
60216,Transporte Ferroviário de Passageiros  Urbano
60224,Transporte Metroviário
60232,Transporte Rodoviário de Passageiros  Regular  Urbano
60240,Transporte Rodoviário de Passageiros  Regular  não Urbano
60259,Transporte Rodoviário de Passageiros  não Regular
60267,Transporte Rodoviário de Cargas  em Geral
60275,Transporte Rodoviário de Produtos Perigosos
60283,Transporte Rodoviário de Mudanças
60291,Transporte Regular em Bondes  Funiculares  Teleféricos ou Trens Próprios para Exploração de Pontos Turísticos
60305,Transporte Dutoviário
61115,Transporte Marítimo de Cabotagem
61123,Transporte Marítimo de Longo Curso
61212,Transporte por Navegação Interior de Passageiros
61220,Transporte por Navegação Interior de Carga
61239,Transporte Aquaviário Urbano
62103,Transporte Aéreo  Regular
62200,Transporte Aéreo  não Regular
62308,Transporte Espacial
63118,Carga e Descarga
63126,Armazenamento e Depósitos de Cargas
63215,Atividades Auxiliares dos Transportes Terrestres
63223,Atividades Auxiliares dos Transportes Aquaviários
63231,Atividades Auxiliares dos Transportes Aéreos
63304,Atividades de Agências de Viagens e Organizadores de Viagem
63401,Atividades Relacionadas À Organização do Transporte de Cargas
64114,Atividades de Correio Nacional
64122,Atividades de Malote e Entrega
64203,Telecomunicações
65102,Banco Central
65218,Bancos Comerciais
65226,Bancos Múltiplos (Com Carteira Comercial)
65234,Caixas Econômicas
65242,Crédito Cooperativo
65315,Bancos Múltiplos (Sem Carteira Comercial)
65323,Bancos de Investimento
65331,Bancos de Desenvolvimento
65340,Crédito Imobiliário
65358,Sociedades de Crédito  Financiamento e Investimento
65404,Arrendamento Mercantil
65510,Agências de Fomento
65595,Outras Atividades de Concessão de Crédito
65919,Fundos de Investimento
65927,Sociedades de Capitalização
65935,Gestão de Ativos Intangíveis não Financeiros
65994,Outras Atividades de Intermediação Financeira  não Especificadas Anteriormente
66117,Seguros de Vida
66125,Seguros Nãovida
66133,Resseguros
66214,Previdência Complementar Fechada
66222,Previdência Complementar Aberta
66303,Planos de Saúde
67113,Administração de Mercados Bursáteis
67121,Atividades de Intermediários em Transações de Títulos e Valores Mobiliários
67199,Outras Atividades Auxiliares da Intermediação Financeira  não Especificadas Anteriormente
67202,Atividades Auxiliares dos Seguros e da Previdência Complementar
70106,Incorporação e Compra e Venda de Imóveis
70203,Aluguel de Imóveis
70319,Corretagem e Avaliação de Imóveis
70327,Administração de Imóveis por Conta de Terceiros
70408,Condomínios Prediais
71102,Aluguel de Automóveis
71218,Aluguel de Outros Meios de Transporte Terrestre
71226,Aluguel de Embarcações
71234,Aluguel de Aeronaves
71315,Aluguel de Máquinas e Equipamentos Agrícolas
71323,Aluguel de Máquinas e Equipamentos para Construção e Engenharia Civil
71331,Aluguel de Máquinas e Equipamentos para Escritórios
71390,Aluguel de Máquinas e Equipamentos de Outros Tipos  não Especificados Anteriormente
71404,Aluguel de Objetos Pessoais e Domésticos
72109,Consultoria em Hardware
72206,Desenvolvimento de Programas em Informática (Desativado)
72214,Desenvolvimento e Edição de Softwares Prontos para Uso
72290,Desenvolvimento de Softwares Sob Encomenda e Outras Consultorias em Software
72303,Processamento de Dados
72400,Atividades de Banco de Dados e Distribuição Online de Conteúdo Eletrônico
72508,Manutenção e Reparação de Máquinas de Escritório e de Informática
72907,Outras Atividades de Informática  não Especificadas Anteriormente
73105,Pesquisa e Desenvolvimento das Ciências Físicas e Naturais
73202,Pesquisa e Desenvolvimento das Ciências Sociais e Humanas
74110,Atividades Jurídicas
74128,Atividades de Contabilidade e Auditoria
74136,Pesquisas de Mercado e de Opinião Pública
74144,Gestão de Participações Societárias (Holdings)
74152,Sedes de Empresas e Unidades Administrativas Locais
74160,Atividades de Assessoria em Gestão Empresarial
74209,Serviços de Arquitetura e Engenharia e de Assessoramento Técnico Especializado
74306,Ensaios de Materiais e de Produtos
74403,Publicidade
74500,Seleção  Agenciamento e Locação de Mãodeobra
74608,Atividades de Investigação  Vigilância e Segurança
74705,Atividades de Imunização  Higienização e de Limpeza em Prédios e em Domicílios
74918,Atividades Fotográficas
74926,Atividades de Envasamento e Empacotamento  por Conta de Terceiros
74993,Outras Atividades de Serviços Prestados Principalmente Às Empresas  não Especificadas Anteriormente
75116,Administração Pública em Geral
75124,Regulação das Atividades Sociais e Culturais
75132,Regulação das Atividades Econômicas
75140,Atividades de Apoio À Administração Pública
75213,Relações Exteriores
75221,Defesa
75230,Justiça
75248,Segurança e Ordem Pública
75256,Defesa Civil
75302,Seguridade Social
80110,Educação Pré-Escolar (Desativado)
80128,Educação Fundamental (Desativado)
80136,Educação Infantilcreche
80144,Educação Infantilpréescola
80152,Ensino Fundamental
80209,Ensino Médio
80217,Educação Média em Formação Geral (Desativado)
80225,Educação Média de Formação Técnica e Profissional (Desativado)
80306,Educação Superior (Desativado)
80314,Educação Superior  Graduação
80322,Educação Superior  Graduação e Pósgraduação
80330,Educação Superior  Pósgraduação e Extensão
80918,Ensino em Auto-Escolas e Cursos de Pilotagem (Desativado)
80926,Educação Supletiva (Desativado)
80934,Educ Continuada ou Permanente e Aprend Profissional (Desativado)
80942,Ensino À Distância (Desativado)
80950,Educação Especial (Desativado)
80969,Educação Profissional de Nível Técnico
80977,Educação Profissional de Nível Tecnológico
80993,Outras Atividades de Ensino
85111,Atividades de Atendimento Hospitalar
85120,Atividades de Atendimento a Urgências e Emergências
85138,Atividades de Atenção Ambulatorial
85146,Atividades de Serviços de Complementação Diagnóstica ou Terapêutica
85154,Atividades de Outros Profissionais da Área de Saúde
85162,Outras Atividades Relacionadas com a Atenção À Saúde
85200,Serviços Veterinários
85316,Serviços Sociais com Alojamento
85324,Serviços Sociais sem Alojamento
90000,Limpeza Urbana e Esgoto e Atividades Relacionadas
91111,Atividades de Organizações Empresariais e Patronais
91120,Atividades de Organizações Profissionais
91200,Atividades de Organizações Sindicais
91910,Atividades de Organizações Religiosas
91928,Atividades de Organizações Políticas
91995,Outras Atividades Associativas  não Especificadas Anteriormente
92118,Produção de Filmes Cinematográficos e Fitas de Vídeo
92126,Distribuição de Filmes e de Vídeos
92134,Projeção de Filmes e de Vídeos
92215,Atividades de Rádio
92223,Atividades de Televisão
92312,Atividades de Teatro  Música e Outras Atividades Artísticas e Literárias
92320,Gestão de Salas de Espetáculos
92398,Outras Atividades de Espetáculos  não Especificadas Anteriormente
92401,Atividades de Agências de Notícias
92517,Atividades de Bibliotecas e Arquivos
92525,Atividades de Museus e de Conservação do Patrimônio Histórico
92533,Atividades de Jardins Botânicos  Zoológicos  Parques Nacionais e Reservas Ecológicas
92614,Atividades Desportivas
92622,Outras Atividades Relacionadas ao Lazer
93017,Lavanderias e Tinturarias
93025,Cabeleireiros e Outros Tratamentos de Beleza
93033,Atividades Funerárias e Serviços Relacionados
93041,Atividades de Manutenção do Físico Corporal
93092,Outras Atividades de Serviços Pessoais  não Especificadas Anteriormente
95001,Serviços Domésticos
99007,Organismos Internacionais e Outras Instituições Extraterritoriais